butthurt	Butthurt	Butthurt is an online slang term used to describe a strongly negative or overemotional response. It is used to draw attention to a person who shows signs of being irritated due to a perceived insult, an unfavorable situation, or a lack of decent communication. On occasions, it can be also used to describe unreasonable users behaviors without an apparent explanation.
daily-dose-piccolo-dick	Daily Dose / Piccolo Dick	“Piccolo Dick” refers to an animated GIF of the Dragon Ball character Piccolo having forced sexual intercourse with Vegeta. The disturbing nature of the picture made it a regular post on the imageboard 4chan, making that users named it Daily Dose, and normally accompanied with images containing the colors green and purple to make the combination of the two colors evolve as a trigger in a person’s subconscious that results in him being reminded of the gif each time he sees those colors. The replies to these images often feature the catchphrase “Thanks, doc”
how-do-i-shot-web	How Do I Shot Web?	“How Do I Shot Web?” is a popular catchphrase paired with an image of Spider-man, that is typically used in online conversations to poke fun at n00bish behavior.
some-men-just-want-to-watch-the-world-burn	Some Men Just Want to Watch the World Burn	Some Men Just Want to Watch The World Burn frequently appears in image macros as an ironic caption pointing out a faux pas or rude gesture.
logan-pauls-suicide-forest-video	Logan Paul's Suicide Forest Video	Logan Paul’s Suicide Forest Video is a viral video by YouTuber Logan Paul in which he discovers a dead body in the Aokigahara forest in the Chūbu region of Honshu in Japan. After the video was uploaded to YouTube in late December 2017, Paul was widely criticized online for exploiting a man’s suicide for clickbait and video views.
scene-wolf	Scene Wolf	Scene Wolf is an Advice Animal image macro series that typically parodies teenage girls who fit into a trendy subculture known as “scene”. The overlaid text often takes the form of an argument between a daughter and one of her parents about her lifestyle choices.
sweating-towel-guy	Sweating Towel Guy	Sweating Towel Guy is an exploitable illustration of a man wiping his sweating forehead with a towel which is often used in “my face when” stories (MFW) on 4chan.
jojos-pose	JoJo's Pose	JoJo’s Pose (Japanese : ジョジョ立ち, JoJo Dachi) refers to various signature poses used by the protagonist characters in the manga series Jojo’s Bizarre Adventure. Largely due to the overdramatic nature of the poses, JoJo’s pose has been subject to parodies and imitations by the manga fans.
wingboner-clopping	Wingboner & Clopping	In the My Little Pony: Friendship is Magic fandom, a Wingboner is considered the pegasus equivalent to a human’s erection. The term “wingboner” originates from the flapping movement of a pegasus when it flares its wings excitedly (usually Rainbow Dash), which may appear as if it had an erection. This flaring motion is often accompanied by the onomatopoeic words “pomf!” or “sproing!”.
nothing-to-do-here-jet-pack-guy	Nothing To Do Here / Jet Pack Guy	“Nothing To Do Here” is a catchphrase associated with the rage comic character Jet Pack Guy who escapes awkward or difficult situations by flying away with his jet pack. It is used in a similar fashion to the jet pack sprouting “Spontaneous Snail” featured in abandon thread images.
lankyposting-he	Lankyposting (HE)	Lankyposting, also known as HE, refers to the practice of posting images of Lanky Kong, a character from the 1999 video game Donkey Kong 64. The practice itself began as a way of satirizing fan hype for potential playable characters in the Super Smash Brothers series by requesting that the supporting character should be included on the roster of the fourth installment.
bill-oreilly-you-cant-explain-that	Bill O'Reilly You Can't Explain That	You Can’t Explain That is an advice animal style image macro series featuring American Fox News Channel political commentator Bill O’Reilly. The captions presuppose that O’Reilly does not understand how mundane occurrences work, similar to the confusion presented in derivatives of Insane Clown Posse’s song Miracles derivatives.
you-had-one-job	You Had One Job	“You Had One Job” is an expression used to call attention to perceived blunders made by individuals on the job. On the web, the phrase is heavily associated with FAIL image macros.
qwop	QWOP	QWOP is a Flash-based video game created by independent game developer Bennett Foddy, in which the player attempts to run down a track to cross a finish line. The game is known for its intentionally frustrating control system, with each limb being controlled individually.
wigglegrams	Wigglegrams	Wigglegrams (also known as stereographs) are animated images that simulate 3D effect by looping two or three frames of an object shot from the vantage points of the viewer’s right and left eyes. Similar to cinemagraphs, each instance usually consists of a few continuous frames that play in loop.
doctor-whooves-time-turner	Doctor Whooves / Time Turner	Doctor Whooves, also referred to as “Doctor Whoof” and “Time Turner”, is a background earth colt character from My Little Pony: Friendship is Magic. He is a light brown pony with a dark brown mane and light blue eyes. Fans refer to him as the Sole Survivor of Gallopfrey. Some fans thought the colt resembled the tenth incarnation of Doctor Who, David Tennant, due to his spiked brown hair and hourglass cutie mark.
religion-pigeon	Religion Pigeon	Religion Pigeon is an advice animal image macro series featuring a photograph of a pigeon with a blue and yellow color wheel background. Similar to the Advice God and Scumbag Christian advice animals, the captions typically mock perceived religious contradictions found in various denominations of Christianity.
dont-talk-to-me-or-my-son-ever-again	Don't Talk To Me Or My Son Ever Again	“Don’t Talk To Me Or My Son Ever Again” is a catchphrase associated with images featuring an iconic fictional character and its miniature offspring, the latter of which is produced by modifying the former character in image-editing applications like Photoshop. Originally introduced through a fan-made parody image of the Cowboy Bebop character Spike Spiegel in November 2014, the meme has seen a significant resurgence on Tumblr and Twitter following an influx of derivative “father-and-son” character images in late 2015.
push-it-somewhere-else-patrick	Push It Somewhere Else Patrick	Push It Somewhere Else Patrick (also known as “Pushing Patrick”) is an image macro series based on a scene from the animated television series SpongeBob SquarePants. The captions typically use the snowclone template “We should take X and put it Y” or “We should X and Y" to suggest an alternative solution to a given problem.
210-would-not-bang	2/10 Would Not Bang	2/10 Would Not Bang is an image macro series in which photos of physically attractive women (and occasionally men) are scrutinized for minor or imagined flaws, prefaced by an ironically low rating on a scale of one to ten. The images are meant to parody hypercritical judgments made about women’s sex appeal on the Internet.
amerimutt-le-56-face	Amerimutt / Le 56% Face	Amerimutt, also known as Le 56% Face, is the nickname given to a series of illustrations depicting a mixed-race American who identifies as white, referencing a statistic that whites compromise 56% of the American population.
anime-was-a-mistake	"Anime Was a Mistake"	“Anime Was a Mistake” is a troll quote misattributed to Hayao Miyazaki, one of the most popular and influential Japanese artists and film directors in anime history, that conveys a strong sense of disdain towards the art of anime and its fanbase at large, including those who identify themselves with weeaboo and otaku subcultures.
naked-banana	Naked Banana	Naked Banana is an image that gained notoriety on imageboards, mostly being used as an out of context image on various boards on 4chan.
they-told-me-i-could-be-anything-i-wanted	They Told Me I Could Be Anything I Wanted	“They Told Me I Could Be Anything I Wanted”, sometimes known as “They Said I Could Become Anything”, is a snowclone phrase often used with portrait-style image macros to parody PTSD Clarinet Boy or to make fun of the subject’s physical appearance. The phrasal template typically takes the form of “They told me I could be anything I wanted, so I became (X).”
girls-laughing	Girls Laughing	For bros on the Internet, girls-laughing.jpg is the most powerful form of insult above all else.
lolgraphs	LOLgraphs	LOLgraphs are statistical representations and visual aids typically designed to explain a wide range of non-academic and mostly trivial topics for humorous effect.
funny-error-messages	Funny Error Messages	Funny Error Messages refers to parodies of computer error messages which appear to indicate a computer or website is malfunctioning while explaining the fake error in a humorous manner or real error messages engineered to be funny.
trust-nobody-not-even-yourself	Trust Nobody, Not Even Yourself	“Trust Nobody, Not Even Yourself” is an exploitable catchphrase associated with a photoshopped image of a teenage boy pointing a gun at a clone of himself that went viral online in September 2014.
yolo	YOLO	“YOLO” is an acronym for the phrase “you only live once” which is often used as a hashtag on Twitter to bring attention to exciting events or an excuse for irresponsible behaviors.
laughing-tom-cruise	Laughing Tom Cruise	Laughing Tom Cruise refers to a series of photoshopped images and remix videos based on a press photograph of the famous American actor laughing manically during his on-stage appearance as a guest speaker at a Yahoo! conference in early 2006.
facebook-timeline-covers	Facebook Timeline Covers	Facebook Timeline Covers are customizable banner images that are strategically placed on Facebook Timeline profiles to serve as extended background for the square-dimension profile photos. The two images are typically framed to appear as if they are interconnected or the portrayed subjects are interacting with each other.
droste-effect	Droste Effect	Droste Effect refers to an artistic technique that creates a recursive picture in which a smaller version of the image is placed inside itself repeatedly. In still images, the recursion is limited by the fixed resolution of the picture but can repeat as an infinite loop in animations.
anime-girls-comparison-parodies	Anime Girls Comparison Parodies	Anime Girls Comparison Parodies refers to images where a group of different characters from anime is presented surrounding a theme but one or more doesn't follow the pattern. The joke character is usually not a girl and from a different genre of media making them appear out of place in the image.
doomguy-and-isabelle	Doomguy and Isabelle	Doomguy and Isabelle is a fan art trend that started in October of 2019. Pieces tend to feature both characters paired in cute and/or gory situations or changing costumes and jobs. The trend came about as a result of DOOM Eternal's delayed-release to March 20th, 2020, the same day as Animal Crossing: New Horizons.
ranka-lees-kira-pose	Ranka Lee's Kira Pose	Kira! (Japanese: キラッ☆) is a trademark hand gesture used by Ranka Lee, a fictional pop idol from the popular TV anime series Macross Frontier. In one of her songs called “Interstellar Flight” (星間飛行, Seikan Hikou), Ranka juts the \m/ sign (“I love you” in sign language) next to her face and yells “Kira!” which means “glittery” or “shiny”. Both the Kira! pose and the dance in its entirety have been reiterated through various kind of videos/illustrations on the web.
youre-doing-it-wrong	You're Doing It Wrong	A common phrase to show hillarious fails.
draw-me-like-one-of-your-french-girls	Draw Me Like One of Your French Girls	“Draw Me Like One of Your French Girls” is an expression from the 1997 drama film Titanic which is often used to caption photos of people or animals laying down in an alluring pose.
4chan-drinking-game-cards	4chan Drinking Game Cards	4chan Drinking Cards are a series of images that use a basic card template with an image of a character (usually in reference to 4chan-related memes) and instructions on who has to drink based on something related to the pictured chracter.
virgin-killing-sweater	Virgin-Killing Sweater	Virgin-Killing Sweater, also known as Sweater That Kills Virgins (Japanese: 童貞を殺すセーター, Doutei wo Korosu Sētā) and That Sweater (Japanese: 例のセーター, Rei no Sētā or あのセーター, Ano Sētā), are nicknames given to a halter neck sweater with a seductively large open back. In a similar vein to the Keyhole Turtleneck, the sweater became a trending topic among Japanese Twitter users in late January 2017.
nut-button	Nut Button	Nut Button refers to an image of a hand going to hit a blue button, badly edited to have the word “NUT” on it. The image often has text above it, usually “When you’re hitting it from behind and she turns around and moans ‘X’”, or something similar.
racists-on-4chan	Racists On 4chan	Racists on 4chan, also known as “Niggerwalks”, is a four-pane comic series that parodies the drastic discrepancies between how a typical bigot interacts with minorities in real-life, and the racist comments that run rampant on sites like 4chan. Most instances usually begin with a brief exchange between two pedestrians of different ethnicity, and ends with one of them posting a hateful message about the encounter on 4chan. Other variations have drifted from the subject of race to wide variety of different rivalries.
luke-je-suis-ton-pere-cartoon-parodies	"Luke, je suis ton père" cartoon parodies	Luke, je suis ton père parodies are 1-pane exploitable comics featuring Darth Vader (“Dark Vador” in French) and a kneeling Luke Skywalker face to face while reviving the famous Star Wars episode 5: The Empire Strikes Back movie scene when the former reveals that he is Luke’s father.
These parodies were first made with puns and rhymic alternate lines, but it then expanded itself to replace Darth Vader by many French culture icons such as politicians, singers and so forth.
console-wars-console-debates	Console Wars / Console Debates	Console Wars (also dubbed Console Debates) are a type of flame war between fans of video game consoles. Console debates lead to the coining of the phrase The Glorious PC Gaming Master Race. The Eighth Generation of gaming consoles also lead to the creation of animated GIFs and image macros depicting battles of competitors. These debates are characterized as being lead by fanboys and often parallel PC Wars and Browser Wars debates.
objection	Objection!	“Objection!” is a image macro series where the subject is often pointing an index finger next to the iconic speech bubble from the game Phoenix Wright, which exclaims “Objection!” These images can then be used as reaction images by those who wish to bring up contradicting facts to a claim previously posted. (See also Phoenix Wrong)
pokepuns	Pokepuns	Pokepuns are an image macro series illustrating various puns and wordplay based on the character names of the Nintendo anime and video game franchise Pokémon.
big-chungus	Big Chungus	Big Chungus refers to an image of cartoon character Bugs Bunny, usually captioned with the phrase "Big Chungus" and presented as a game for "PlayStation 4" console. The word "chungus" was coined by video game journalist Jim Sterling several years before the meme became popular.
super-smash-bros-character-predictions	Super Smash Bros Character Predictions	Super Smash Bros. Character Predictions are online discussions about the evolving roster of playable characters in Nintendo’s crossover melee fighting game franchise Super Smash Bros. Since the release of its first sequel title Super Smash Bros Melee for GameCube in 2001, speculations and parodies of the latest inductees to the franchise have become a recurring discussion topic within the fandom, usually peaking right before or after Nintendo’s announcement of a new sequel title in the series.
war-propaganda-parodies	War Propaganda Parodies	Propaganda parodies have consistently been a subject of image editing and photoshopping over the past 40 years, even before the internet was created.
longcat	Longcat	Longcat is a nickname given to a cat who is quite long.
dick-flattening	Dick Flattening	Dick Flattening refers to a type of cock and ball torture which involves flattening one's penis via placing it between two flat surfaces and applying pressure to it. In late February 2020, Yes Chad-type memes in which one character submits to another and agrees to undergo dick flattening gained popularity online.
lolwut	LOLWUT	Would you eat this pear? Probably not. It would probably eat you first anyway.
gym-leader-bea	Gym Leader Bea	Bea is a Fighting-type gym leader set to appear in Pokémon Sword and Shield. After she appeared in a trailer before the game's release, she quickly inspired lots of fan art, with a significant portion of that fan art emphasizing the fact she is barefoot.
stahp	Stahp	Stahp is a four-pane comic meme which consists of photographs depicting a disturbed-looking subject in progressive zoom, accompanied by the caption "Stahp" or "stop."
30-year-old-boomer	30-Year-Old Boomer	30 Year-old Boomer refers to a character spread on 4chan mocking older millennials who enjoy things deemed out of touch with younger millennials, particularly in regards to video games. The phrase generally appears in a greentext snowclone reading "that 30 year old boomer who X" and is accompanied by a specific Brainlet Wojak variation.
somebody-that-i-used-to-know	"Somebody That I Used To Know"	"Somebody That I Used to Know" is a 2011 indie pop song by the Australian singer-songwriter Gotye, with additional vocals by the New Zealand singer Kimbra.
fgsfds	fgsfds	fgsfds (pronounced figgis-fiddis or F-G-S-F-D-S)is a saying used when something is getting much too silly or has lost all traces of sanity.
wario	Wario	Wario is a fictional character from the Nintendo video game franchise Super Mario. Designed by Hiroji Hiyotake, Wario was designed to be Mario’s rival, a villainous inverse of the hero with similar clothes and certain characteristics. He was voiced by Charles Martinet. After appearing in the Super Mario Land series as a boss enemy, he later went on to become a Nintendo icon, spawning two of his own series, Wario Land and WarioWare.
zalgo	Zalgo	Zalgo is an Internet legend about an ominous entity believed to cause insanity, death and destruction of the world, similar to the creature Cthulhu created by H.P. Lovecraft in the 1920s. Zalgo is often associated with scrambled text on webpages and photos of people whose eyes and mouth have been covered in black.
ridley-is-too-big	Ridley is Too Big	“Ridley is Too Big” is an argument against allowing the alien creature Ridley from the Metroid video game series to become a playable character in the Super Smash Bros. fighting video games due to his large size relative to other characters.
piper-perri-surrounded	Piper Perri Surrounded	Piper Perri Surrounded refers to a series of object labeled and photoshopped image macros of adult film star Piper Perri sitting on a couch and five black men standing behind her. Online, the image is labeled to express naive indifference to an overwhelming series of problems.
super-bowl-xlix-halftime-left-shark	Super Bowl XLIX Halftime "Left Shark"	The Left Shark, also known as the Super Bowl Halftime Shark, is a nickname given to one of the stage dancers dressed in a shark costume during Katy Perry’s halftime performance at the Super Bowl XLIX on February 1st, 2015.
fallout-equestria	Fallout: Equestria	Fallout: Equestria is a crossover fanfiction between the cartoon series My Little Pony: Friendship is Magic (MLP: FiM) and the role-playing video game series Fallout. The series has inspired numerous fanfiction alternate universes from the original and has also inspired fan-made animations, video games, and other works related to the story.
it-s-machine-code	It's Machine Code	It's Machine Code is an exploitable 3 panel comic from DC comics. The panels have featured CAPTCHAs, Konami code, and many others. Find out more on KYM.
imminent-ned-brace-yourselves-winter-is-coming	Imminent Ned / Brace Yourselves, Winter is Coming	Imminent Ned (also know as “Winter is Coming”) is an image macro series featuring the character Eddard “Ned” Stark from the HBO series Game of Thrones, a television adaption of George R. R. Martin’s epic fantasy novel series A Song of Ice and Fire. Its snowclone template “Brace Yourselves, X is Coming” can be versatilely used to forewarn or proclaim the impending arrival of a highly anticipated event, a product or an internet meme.
the-dress-what-color-is-this-dress	The Dress / What Color Is This Dress?	The Dress refers to a photograph of a women's dress manufactured by the UK fashion company Roman Originals. Due to the apparent ambiguity of the dress' colors, which were interpreted as either white-and-gold or black-and-blue, the photograph became the subject of an intense online debate after a post challenging the viewers to identify its true colors went viral on Tumblr.
is-this-a-jojo-reference	Is This a JoJo Reference?	“Is That a JoJo Reference?” is a rhetorical question often used ironically by online commenters in response to pictures that include allusions to the manga and anime series JoJo’s Bizarre Adventure.
unflattering-beyonce	Unflattering Beyonce	Unflattering Beyonce is an exploitable photoshop meme based on humorously timed screen captures of the singer Beyonce from her 2013 performance at Super Bowl XLVII. After her publicist requested BuzzFeed remove images deemed “unflattering,” the photos instantly became a trending topic in the social media and spread more widely than ever before, a phenomenon known as the Streisand Effect.
its-over-9000	It's Over 9000!	Over 9000 is a popular catchphrase derived from the Japanese manga anime series Dragon Ball Z, typically used as an innumerable quantifier to describe a large number of something like "several", "lots", "butt loads" and even the metric "ass tonne".
mcdonalds-happy-mascot	McDonald’s "Happy" Mascot	McDonald’s “Happy” Mascot is an anthropomorphic cartoon character of a Happy Meal box introduced as a new mascot for the fast food restaurant chain McDonald’s in the United States in May 2014. Upon its debut in the social media, the character became a target of online mockeries for its creepy facial expression
binders-full-of-women	Binders Full of Women	According to Mitt Romney, he looked at "binders full of women" during his search for senior-level staff during his time as Governor of Massachusetts.
kamina-glasses	Kamina Glasses	Kamina Glasses (sometimes referred to as Kamina shades or Gar glasses) are a pair of orange, triangle shaped glasses used as a photoshop item added to a person or object, based on the pair worn by Gurren Lagann character Kamina. The idea of the meme is to take something plain looking and instantly make it look cool by adding the glasses. Although this is mainly done through Photoshop, they can also be used in a drawing or even as a real prop.
into-the-trash-it-goes-opinion-discarded	Into The Trash It Goes / Opinion Discarded	“Into The Trash It Goes!” is a phrase associated with a picture of an American illusionist Penn Jillette. It’s often used to discredit a person’s viewpoint or opinion.
jesus-is-a-jerk	Jesus is a Jerk	Jesus is a Jerk (also known as “Jesus is a Dick” or “Asshole Jesus”) is a set of image exploitables showing Jesus by average people doing everyday tasks.
prancing-cera	Prancing Cera	Prancing Cera is a photoshop meme featuring a photograph of actor Michael Cera in mid-air leaping from one platform to another on a dock in Haugesund, Norway. The meme involves superimposing a cut-out image of the actor into other base images of various settings and contexts.
hey-beter	Hey Beter	Hey Beter refers to a series of images, comic strips, and remix videos in which a character addresses Peter Griffin from Family Guy with “Hey Peter,” only in writing, the “P” in Peter is replaced with the B Button Emoji. The comics are generally deep fried and reference Black Twitter memes such as Spell ICUP Nigga. They can also feature phrases and advertisements unrelated to the comic.
gyate-gyate-ohayou	Gyate Gyate / Ohayou	Gyate Gyate (Japanese: ぎゃてコラ, Gyate-Kora), occasionally called as “Ohayou” in English-speaking web, refers to a series of parody illustrations for a grin by Kyouko Kasodani from Touhou Project. In a similar vein to Gununu and Moetron, her facial expression is one of the popular templates for drawing among Japanese amateur illustrators.
missingno	MissingNo.	MissingNo. (けつばん Ketsuban?), sometimes pronounced MissingNO, is a Pokémon species found in the video games Pokémon Red and Blue. Short for “missing number,” MissingNo. typically appears during gameplay in Pokémon videogames when the game attempts to access data for a nonexistent Pokémon species as a result of glitch. It is arguably the most well-known glitch Pokémon in the game series.
hide-the-pain-harold	Hide The Pain Harold	Hide The Pain Harold, also simply referred to as “Harold” or “Maurice” is the nickname given to a senior stock photography model whose facial expression appears to indicate suppressed pain and/or discomfort.
