political-compass	Political Compass	The Political Compass is a two-axis model of the political spectrum between libertarian/authoritarian and economic-left/economic-right. Similar to the Myers Briggs Type Indicator, it is a model with websites that invite users to take a survey to see where they stand. It has spawned many parody edits.
starter-packs	Starter Packs	Starter packs, sometimes known as starter kits, are a series of multi-panel photo sets meant to illustrate the archetype of a celebrity, company or subculture through a recommended selection of fashion articles, multimedia and other consumer products, much similar to steal her look fashion guides.
expand-dong	Expand Dong	Expand Dong is a photoshop meme featuring the face of the Nintendo character Donkey Kong with perverted captions below it. While the image and similar parodies were already shared on the online imageboard 4chan at the beginning of 2013, they managed to inspire an even larger series of similar parodies featuring several other video game characters on the microblogging website Tumblr later that year. The images commonly follow the style of Tony Kornheiser’s “Why” reaction face.
60s-spider-man	60's Spider-Man	60s Spider-Man is an image macro series based on still shots from the original Spider-Man cartoon series that aired during the latter half of the 1960s. The series typically features absurd internal monologues that correspond with the actions depicted in the still images.
fsjal	fsjal	Fsjal is a series of MS paint-style artworks centered around a cartoon character originally depicting The Legend of Zelda’s Link with his arms bent in anticipation and his eyes pointing up in eagerness. Since its viral takeoff on 4chan in July 2009, the drawing fad has spawned thousands of user-generated character sprites.
loss	Loss	Loss, also known as CADbortion, Loss.jpg and | || || |_, is a series of parodies based on a dramatic cartoon strip from the webcomic series Ctrl+Alt+Del in which the female lead suffers a miscarriage, which became a subject of widespread mockery among the readers.
demotivational-posters	Demotivational Posters	Demotivational Posters are image macros intentionally designed to discourage one's moral strength and diminish one's self-esteem.
polandball	Polandball	Polandball (aka countryball) is a series of multi-pane comics that depict various countries as personified circles.
casually-pepper-spray-everything-cop	Casually Pepper Spray Everything Cop	Pepper Spray Cop, also known as "Casually Pepper Spray Everything Cop", is a photoshop meme based on a photograph of a police officer pepper spraying a group of Occupy protesters at the University of California Davis.
pony-reactions	Pony Reactions	Pony Reactions are sprite images of characters from My Little Pony: Friendship is Magic making a variety of expressions. The reaction images began with “Shrugpony” based on the character Pinkie Pie and several other characters have been since adopted into the series. (See also: Why Wub Woo, Flutterrage and Fluttercry.)
doge	Doge	Doge is the nickname given to Kabosu, a Japanese Shiba Inu who rose to online fame in 2013 as a fictional character featured in image macros captioned with grammatically awkward phrases in the Comic Sans typeface.
virgin-vs-chad	Virgin vs. Chad	Virgin Walk refers to the gait of a man who appears to show signals of insecurity and lack of confidence by looking at the ground with hunched shoulders. After an MS Paint depiction of the walk began circulating online in March 2017, other illustrations of “virgin” behaviors began appearing on the /r9k/ board on 4chan.
dolan	Dolan	Dolan is an MS Paint web comic series featuring a variety of poorly drawn Disney cartoon characters. The main character Dolan, based on Donald Duck, is often portrayed as a psychopath with a seemingly innocent smile.
soy-boy-face-soyjak	Soy Boy Face / Soyjak	Soy Boy Face, also known as the Soylent Grin, Soyboy Smile, Nu-Male Face, Nu-Male Smile and Cuckface, is an internet slang term referring to a facial expression associated with men described as nu-male or Soy Boys who are photographed expressing surprise or excitement with their mouth agape. Online, a variation of Wojak referred to as "Soyjack" is illustrated with the open-mouthed smile.
tony-kornheisers-why	Tony Kornheiser's "Why"	Tony Kornheiser’s ‘Why’ is an image macro series featuring a stillshot of American sportscaster Tony Kornheiser and the lower third caption reading “Why.” In discussion forums and imageboard communities, Kornheiser’s pictures are often used as reaction images to patronize others’ opinions or viewpoints.
gijinka-moe-anthropomorphism	Gijinka / Moe Anthropomorphism	Moe Anthropomorphism, also known as Gijinka (擬人化 in Japanese for “humanization”), is the trend of creating human-like characters based on non-human subjects, including inanimate objects, animals, brands or concepts. Online, many of the female representations are named using the Japanese honorific “-chan.”
ponify	Ponify	Ponify, commonly written in its past tense form ponified, is a term used to describe people, fictional characters or objects who/which have been turned into a cartoon pony, mainly in the style of characters featured in the television series My Little Pony: Friendship is Magic. The process of ponifying varies from manipulating canonical characters from the show into the role of a character from another fandom or a meme (for example, placing Derpy Hooves into an Ancient Aliens-style photo) to creating a non-canonical My Little Pony character (changing Giorgio A. Tsoukalos into a pony). The infinitive verb to ponify has also been used to describe the jargonization process of Bronyspeak.
doomer	Doomer	Doomer is a Wojak character that began to spread on numerous 4chan boards in mid-September of 2018. Unlike the similar 30 Year-Old Boomer, the Doomer is represented as being in his early 20s and depressed about the state of his life and the world. Additionally, members of 4chan have identified with the character and used it to discuss their mental health, depression, and anti-semitism.
pareidolia	Pareidolia	Things With Faces (Pareidolia) are photographs of objects that resemble the appearance of an animal or face, in a similar vein to Om Nom Nom photoshopped images which involve drawing facial features on inanimate objects.
pokefusion-pokemon-fusion	Pokéfusion / Pokémon Fusion	Pokémon Fusion, also simply known as Pokéfusion, refers to the fan art practice of splicing the sprites of two or more creatures from the Nintendo video game franchise Pokémon to create a new hybrid character either through hand-drawing or web-based generators.
forever-alone	Forever Alone	Forever Alone is a cartoon character image that is used to express loneliness and disappointment with life. It is considered one of the first major "rage comic" characters to be spun off from the original Rage Guy character, which first sprang up on 4chan in 2009.
what-people-think-i-do-what-i-really-do	What People Think I Do / What I Really Do	What People Think I Do / What I Really Do” is a series of visual charts depicting a range of preconceptions associated with a particular field of occupation or expertise.
rage-guy-fffffuuuuuuuu	Rage Guy (FFFFFUUUUUUUU-)	Rageguy refers to the main character of a series of crudely-drawn comics typically consisting of four panes, portraying situations that can bring rage and exasperation, with the main character screaming with anger as a result. Due to its simplicity and exploitability, Rageguy has been proven popular thus being evolved into a comic series now known as Rage Comics.
derpy-hooves	Derpy Hooves	"Special eyes" and "Where's Waldo" styled appearances gave Derpy Hooves an immense following within the Brony fanbase. Find out more about her on KYM.
trollface	Trollface	Trollface is a rage comic character wearing a mischievous smile that is meant to represent the facial expression of an Internet troll. The image is most commonly used to portray a character as a troll in rage comics, or alternatively, to identify oneself or another participant as such in online discussions.
computer-reaction-faces	Computer Reaction Faces	Computer Reaction Faces are reaction face images used to express the emotions of someone sitting in front of a computer screen, which often take the form of comic illustrations and animated GIFs.
gardevoir	Gardevoir	Gardevoir (サーナイト, known as  Sirknight in Japanese) is a third-generation Pokémon character originally introduced as a Psychic type creature in Pokémon Ruby / Sapphire and re-introduced as a Psychic / Fairy dual type with a mega evolution in Pokémon X / Y. Due to Gardevoir’s conspicuous resemblance to a female humanoid, the character has gained an unusually large fan base online, mostly on 4chan’s /vp/ (Pokémon),  /v/ (Video Games) and /b/ (Random) boards.
x-x-everywhere	X, X Everywhere	X, X Everywhere is a phrasal template typically used for a wide range of cultural references, from quotable lines heard in popular films and TV shows to more obscure things found in viral videos and games. Many instances of “X Everywhere” may be seen as an indicator for emerging trends, while some should be read as a grievance or complaint against them, depending on the context.
top-10-anime-list-parodies	Top 10 Anime List Parodies	Top 10 Anime List Parodies refers to a series of image edits of screenshots of various anime top 10 list videos, typically by WatchMojo, which replace the still from the video with another image for humorous effect that parodies the conventions of clickbait.
what-i-watched-what-i-expected-what-i-got	What I Watched / What I Expected / What I Got	"What I Watched, What I Expected, What I Got" is an image macro series that consists of three visual metaphors on any given subject topic, with most iterations typically commentating on popular anime and video games.
bertstrips	Bertstrips	Bertstrips is an image macro series featuring screenshots of characters from the American children’s television show Sesame Street captioned with humorous and often inappropriate descripitons in the style of Bitstrips webcomics.
i-know-that-feel-bro	I Know That Feel Bro	“I Know That Feel Bro” is a catchphrase and reaction image depicting two bros embracing each other. The phrase is typically used to show sympathy.
bowsette	Bowsette	Bowsette is an anthropomorphised genderbend version of the Super Mario villain Bowser caused by the effects of the Super Crown power up. Following the creation of the character shortly after the release of a trailer for New Super Mario Bros. U Deluxe, it quickly gained a large amount of popularity on both the western and eastern web.
sonic-original-characters	Sonic Original Characters	Sonic OCs (short for Sonic Original Characters) stands for a series of fan-made characters from the Sonic the Hedgehog universe. Whereas their large quantity has made them a notable popular part of the Sonic Fandom, elsewhere on the internet they are common targets of mock due to the overall low quality of some characters and their association with the younger audiences.
haters-gonna-hate	Haters Gonna Hate	"Haters Gonna Hate" is a catchphrase used to indicate a disregard for hostile remarks addressed towards the speaker. The popular idiom, which has its roots in hip hop lyrics, spawned an image macro series featuring pictures of celebrities, animals and cartoon characters strutting or posing in a carefree  manner.
joseph-ducreux-archaic-rap	Joseph Ducreux / Archaic Rap	Joseph Ducreux was an eighteenth century French artist known for his unorthodox style of portrait paintings. On the Internet, his eccentric self-portrait has inspired a series of exploitable macros, featuring "archaic reinterpretation" of popular rap lyrics superimposed over the artwork. Reminiscent of Bayeux Tapestry image macros, this highly verbose joke provides a satisfying challenge of "decoding" the corrupted lyrics back into to the original verses.
y-u-no-guy	"Y U NO" Guy	“Y U NO” Guy is a rage comic character used in image macros to call out an issue or subject matter one deems to be worthy of more attention. The unique facial expression worn by character is believed to have been traced from the Japanese sci-fi manga and anime series Gantz.
surreal-memes	Surreal Memes	Surreal Memes are a subgenre of Ironic Memes that are artistically bizarre in appearance and whose humor derives from their absurd style. Though the difference between Surreal Memes and Deep Fried Memes and Dank Memes is subtle, certain qualities and characters, such as Layers of Irony, Meme Man, Mr. Orange, and a minimalist style, are frequent markers of a Surreal Meme.
dj-p0n-3-vinyl-scratch	DJ P0N-3 / Vinyl Scratch	DJ P0N-3 (also known as Vinyl Scratch) is a nickname given to a background unicorn character from the animated TV series My Little Pony: Friendship is Magic. Despite her very brief appearance as a nameless disk jockey in one of the episodes, the character’s cool demeanors caught the attention of My Little Pony fans and led to a series of audio / video remixes on YouTube, usually set to electronica and house music.
my-brand	My Brand	My Brand is a series of parody videos inspired by a commercial for the contact lens retail company 1-800 CONTACTS in which a man yells the phrase out of joy after receiving his preferred brand of prescription eye wear.
happy-merchant	Happy Merchant	Happy Merchant is a cartoon portraying a male Jew based on anti-Semitic views, giving it characterizations such as greed, manipulative, and the need for world domination. Mainly posted on political imageboards such as 4chan’s /pol/ and 4chon’s /new/, it is used both ironically and seriously.
vivian-james	Vivian James	Vivian James is a fictional character conceived through a collaboration between 4chan‘s /v/ (video games) board and the indie game developer group The Fine Young Capitalists. The character can be viewed as an anthropomorphized avatar of the /v/ board community created in response to Zoe Quinn’s purported attack on the second-wave feminist organization The Fine Young Capitalists (TFYC) while they were trying to fund a Game Jam to assist women’s projects in gaming development.
brazzers	Brazzers	"Brazzers," not to be confused with the eponymous adult entertainment production company, is a photoshop meme that involves overlaying the logo of the porn site on otherwise innocent photographs of two or more subjects. The purpose of the joke is to make it seem as if the image had been actually screen-captured from an adult film produced by the studio.
potato-jesus	Potato Jesus	Botched Ecce Homo Painting, also known as “Potato Jesus”, refers to the failed restoration of a century-old Spanish devotional fresco, executed by elderly amateur art restorer Cecilia Jiménez. The result of the botched restoration spawned a photoshop meme, in which the ruined painting was edited in to other famous works of art, movie scenes or other memetic images.
nightmare-fuel	Nightmare Fuel	Nightmare Fuel is a slang term used to describe images, videos or stories that are creepy enough to result in nightmares or other physical reactions for the person consuming the content.
squid-sisters	Squid Sisters	The Squid Sisters are a female character duo named “Callie” and Marie" (a pun on calimari, a squid based dish) who appear in the video game Splatoon. The sisters serve as the announcers for in-game related news such as events and new downloadable content. They are known for their catchphrase “Stay Fresh.”
pacha-edits-when-the-sun-hits-that-ridge-just-right	Pacha Edits / When The Sun Hits That Ridge Just Right	Pacha Edits refers to a photoshop meme based on several exploitable images of Pacha, one of the main characters featured in Disney‘s animated buddy comedy film series The Emperor’s New Groove, most notably a stillshot of the character signaling an OK gesture with his left hand in satisfaction. Since debuting on 4chan in late January 2016, the still shots of Pacha have spawned hundreds of photoshopped derivatives on numerous forums within the imageboard community, often accompanied by snowclone variants based on the quote “When The Sun Hits That Ridge Just Right.”
troll-quotes	Troll Quotes	Troll quotes are image macros that feature a quote from a popular movie or TV show and attribute the quote to a character in another popular movie or TV show. Often the background image will come from a third unrelated pop culture source. These images are created in order to annoy or troll members of all the involved fandoms who will quickly identify the obviously incorrect attribution.
trolldad	Trolldad	If your dad says you were adopted, he might be a Trolldad. 
…Or you might have been adopted.
galaxy-brain	Galaxy Brain	Galaxy Brain, also known as Expanding Brain, is a multi-panel exploitable image series showing the increasing brain activity of a person in relation to other variables.
xzibit-yo-dawg	Xzibit Yo Dawg	"Yo Dawg" is an image macro series based on portrait shots of American hip hop artist Alvin Nathaniel Joiner (better known by his stage name Xzibit) and humorous captions that are composed around the recursive phrasal template "Yo Dawg, I herd you like (noun X), so I put an (noun X) in your (noun Y) so you can (verb Z) while you (verb Z)." Since rising to popularity in early 2007, the series has been considered one of the most well-known and longest lasting examples of recursive humor on the Internet.
deal-with-it	Deal With It	"Deal With It" is an expression used as a retort in response to someone’s disapproval. It is often associated with image macros and animated GIFs in which the subject wears a pair of sunglasses.
that-really-rustled-my-jimmies	That Really Rustled My Jimmies	"That Really Rustled My Jimmies" is an expression used to convey one's feelings of discontent or discomfort in response to someone else's post on image boards and discussion forums.
ancient-aliens	Ancient Aliens	Ancient Aliens is a series of image macros based on History Channel's TV series with the same name starring alien expert Giorgio A. Tsoukalos, who often tends to explain inexplicable phenomena as the direct result of aliens or extraterrestrials being on Earth.
grumpy-cat	Grumpy Cat	Grumpy Cat is the nickname given to Tardar Sauce, a snowshoe cat that rose to online fame after several pictures of her annoyed facial expressions were posted to Reddit in late September 2012.
bad-luck-brian	Bad Luck Brian	Bad Luck Brian is an advice animal character based on a photograph of a blonde-haired teenager wearing a plaid sweater vest and dental braces. In the image macro series, the character is portrayed as  a cursed victim of misfortunes or a scapegoat in humiliating situations of varying degrees.
sad-keanu	Sad Keanu	Sad Keanu is a photoshop meme based on a paparazzi photograph of the Canadian American actor Keanu Reeves sitting on a park bench and enjoying a sandwich by himself.
all-the-things	All the Things	“X all the Y”, sometimes known as “X all the things”, is a snowclone and exploitable cartoon used to make a hyperbolic statement about performing an action. The person in the original comic panel is often manipulated to appear as a different character. (See also: fsjal)
fuck-yea	Fuck Yea	"Fuck Yea" Guy is a rage comic character of a stick figure standing in a triumphant pose with a determined look on its face. Originally posted to 4chan on February 11th, 2010, the character is used in cartoons to illustrate all sorts of small victories in our daily lives. It can be also seen as the antithesis of Rage Guy, the original rage comic character.
rebecca-black-friday	Rebecca Black - Friday	Rebecca Black is an amateur YouTube musician who soared into the public eye for her music video “Friday.” The song gained significant online notoriety in March 2011 for its monotonous lyrics accompanied by heavy use of auto-tune.
slender-man	Slender Man	Slender Man is a mythical creature often depicted as being tall and thin, wearing a black suit with a white shirt and necktie, and having a blank face. Since its first appearance on Something Awful in June 2009, the urban legend has inspired a prolific volume of fan artworks, fictional creepypastas and mockumentary web series.
fluttercry-characters-watching-tv	Fluttercry / Characters Watching Tv	The image gallery for this entry contains major spoilers for various media (video games, movies, etc.). View at your own risk!
philosoraptor	Philosoraptor	Philosoraptor is an advice animal image macro series featuring an illustration of a Velociraptor paired with captions depicting the dinosaur as being deeply immersed in metaphysical inquiries or unraveling quirky paradoxes.
valentines-day-e-cards	Valentine's Day E-cards	Valentine’s Day E-cards refer to a variety of digital greeting cards that are exchanged among friends on social media platforms in celebration of the annual holiday, most notably on Tumblr and Pinterest.
unitinu-uniti%D0%B8u	UNITINU / UNITIИU	UNITIИU (also commonly spelled UNITINU) is a photoshop meme in which each subject has been mirrored to appear rather ridiculous in bilateral symmetry. Since emerging through a mirrored photograph of the former United States Secretary of State Condoleezza Rice in 2006, the series has grown into an internet legend surrounding the fictional nation-state of UNITINU..
npc-wojak	NPC Wojak	NPC Wojak is a depiction of the MS Paint character Wojak with a blank stare and facial expression, named after non-player characters within video games. The character is meant to represent people who do not think for themselves and conform to society, bearing many similarities to the terms "basic" and "normie".
strutting-leo	Strutting Leo	Strutting Leo is a photoshop meme featuring a photograph of the actor Leonardo DiCaprio walking merrily toward the camera while on the set of the 2010 science fiction film Inception. Examples of the meme typically superimpose DiCaprio’s cutout image into various humorous contexts, similar to the Disaster Girl and Prancing Cera exploitable series.
socially-awkward-penguin	Socially Awkward Penguin	Socially Awkward Penguin is an image macro series featuring a penguin with zero self-esteem and zero social skills.
give-pikachu-a-face	Give Pikachu a Face	The Pikachu template meme is an exploitable template that users can take and create their own funny and sometimes deranged Pikachus. The template of Pikachu’s head is the most popular but people will also use full body pictures of pikachu they find using image searches.
dat-ass	'Dat Ass	The man in the picture has been identified as southern rapper Rich Boy (real name: Maurice Richards), who was co-hosting MTV’s music variety program TRL with rapper Ne-Yo in New York’s Times Square on March 13, 2007. Contrary to the widespread rumors, the rapper depicted in the image is NOT Kanye West.
courage-wolf	Courage Wolf	Courage Wolf is an image macro series derived from the original Advice Dog series. In contrast to Advice Dog, who might unknowingly lead you to do something you’ll regret, Courage Wolf will help you achieve greatness with often extreme, overwhelming advice.
childhood-enhanced	Childhood Enhanced	“Childhood Enhanced” is an expression used to describe characters from children’s fiction that have been updated for mature audiences, which is often seen as a positive spin on the Ruined Childhood meme.
delet-this	Delet This	Delet This, often intentionally misspelled and accompanied by a reference to or a photograph of a gun, is a copypasta used on message boards and comments systems to threaten, often ironically, that the original post is too extreme.
instagram-quote-rebuttals-hipster-edits	Instagram Quote Rebuttals / Hipster Edits	Hipster Edits (a.k.a. Instagram Quote Rebuttals") are a series of image macros typically designed to ridicule “profound monologue” photos. It consists of a picture, usually taken with Instagram feature and hence the term “Hipster Edit”, an ostensibly meaningful quote and a buzzkilling remark denoted underneath in red text. It can be seen as a mockery of hipster culture in similar vein to Hipster Kitty and Hipster Ariel.
handsome-face	Handsome Face	Handsome Face is an exploitable cartoon character based on a still-shot of an effeminate-looking Superman.
troll-science-troll-physics	Troll Science / Troll Physics	Troll Science, also known as “Troll Physics”, is a rage comic series illustrating various experiments that are based on faulty understanding of scientific concepts. The intentionally pseudo-scientific drawings are often used to mislead the viewers or frustrate science educators and students for their obvious errors.
facepalm	Facepalm	Facepalm, also known as "facepalming," refers to the act of placing one's face in one's hands, a form of nonverbal-communication common among many cultures. The action conveys a message of dismay and is often a reaction toward someone's momentary lapse of logic, judgement, or memory. This reaction may be directed toward another person or be self-deprecating. Online, people post images, GIFs and videos of people performing the motion to express embarrassment towards someone else's actions.
baneposting	Baneposting	Baneposting refers to referencing and parodying an awkward dialogue between a CIA agent and the captive villain Bane from the opening scene of the 2012 DC superhero action film The Dark Knight Rises, the final installment of the Batman film trilogy directed by Christopher Nolan.
steam-user-reviews	Steam User Reviews	Steam User Reviews are tongue-in-cheek customer reviews of various video games titles that are available for purchase on Valve’s online marketplace platform Steam, in a very similar vein to the facetious reviews that are posted by users on Amazon and eBay.
