kyubey	Kyubey	Kyubey (キュゥべえ), also known by its nickname “QB” and ASCII form ／人◕ ‿‿ ◕人＼﻿, is a mysterious character from the popular fantasy “magical girl” anime series Puella Magi Madoka Magica. Due to the show’s popularity in Japan and Kyubey’s characterization as a deceptive, evil creature with an angel-like appearance, it quickly grew into a target of obsession for the Japanese anime fans and illustrators. According to various accounts, Magi Madoka Magica is one of the most discussed anime series on the Japanese textboard site 2channel, even in comparison to the notorious Haruhi Suzumiya series.
cthulhu	Cthulhu	Cthulhu is a fictional character created by H.P. Lovecraft and his first appearance was made in the short story ‘The Call of Cthulhu’, which was published in the February, 1928 edition of Weird Tales (a fantasy/horrific magazine that ran from 1923 to 1954).
smug-frog	Smug Frog	Smug Frog, also known as Smug Pepe, is a reaction image of a smug-looking frog based on an original cartoon illustration of Pepe, better known as Feels Good Man and Sad Frog, drawn by webcomic artist Matt Furie.
look-at-all-the-fucks-i-give	Look At All The Fucks I Give	“Look At All The Fucks I Give” is a catchphrase often used in image macros and animated GIFs to show how little one cares about what someone else is talking about. Similar to “Cool Story Bro” and “Not A Single Fuck Was Given That Day”, it is a sarcastic iteration of the colloquial phrase “I don’t give a fuck” and the images usually feature someone standing with his/her arms wide open.
me-and-the-boys	Me and the Boys	Me and the Boys is a snowclone caption used in memes about various activities. Originally popular as a hashtag and a non-ironic caption, in early 2019 the phrase, paired with non-sequitur followups, gained popularity in /r/okbuddyretard subreddit and on Instagram, gaining mainstream attention with 60's Spider-Man villains variations in late May 2019.
ridiculously-photogenic-guy	Ridiculously Photogenic Guy	Ridiculously Photogenic Guy (RPG) is a photoshop meme and advice animal featuring a photo of a smiling man called Zeddie Little running in the 2012 Cooper River Bridge Run. The photo gained notoriety online after being posted to the social news website Reddit where users found the man to be exceptionally handsome.
fistful-of-yen	Fistful of Yen	Fistful Of Yen is a two-panel exploitable showing what certain fictional characters would do if offered a large sum of money, commonly resulting in sexual favors or other perverted stuff.
make-your-own-album-cover	Make Your Own Album Cover	If you’re on Facebook, you’ve probably done it or seen your friends do it plenty of times. Popularly known as Make Your Own Album Cover (or shortly “album cover”), this DIY game first began as a Flickr group project circa early 2008 and subsequently crossed over to other social networking sites like Facebook through the following year.
is-this-a-pigeon	Is This a Pigeon?	“Is this a pigeon?” is a memorable quote said by the protagonist character from the 1990s Japanese anime TV series The Brave Fighter of Sun Fighbird in a scene wherein the humanoid character erroneously identifies a butterfly as a pigeon. On Tumblr, the quote, along with a reaction image of the scene featuring the English-translated subtitle, is widely used to express utter confusion.
advice-animals	Advice Animals	Advice Animals, sometimes referred to as “Advice Dog spin-offs”, are a type of image macro series featuring animals of some kind (including humans) that are accompanied by captioned text to represent a character trait or an archetype that fits the role of a “stock character”. While many Advice Animals use a color wheel background, some use unedited versions of the original photo.
smug-wendys	Smug Wendy's	Smug Wendy’s, also known as Wendy-chan, is an anime-style anthropomorphic personification of the @Wendys Twitter feed, which gained much online notoriety for its funny and sarcastic responses to customer complaints and questions.
okay-guy	Okay Guy	Okay Guy is a rage comic character wearing a sullen expression while uttering the word "okay." The image of the character is often used to convey feelings of self-helplessness or being pushed over.
coaxed-into-a-snafu	Coaxed Into a Snafu	“Coaxed Into a Snafu” refers to a series of poorly drawn rage comic and advice animal characters that are captioned with variations of popular Internet catchphrases. The illustrations typically mock the way Internet memes are incorrectly used on sites like 9gag and Reddit.
sweetie-belle-derelle	Sweetie Belle Derelle	Sweetie Belle Derelle is an exploitable reaction image featuring the character Sweetie Belle from My Little Pony: Friendship is Magic with her eyes pointed in opposite directions and her mouth opened wide. The image is usually used to derail a forum or image board thread, also known as thread jacking, by spamming the thread full of pictures of Sweetie Derelle, often including repetitive capitalized "A"s.
intensifies	[Intensifies]	[Intensifies] is an Internet slang term that is typically used in audio descriptive image macros and vibrating GIFs to denote a drastic build-up of a particular action, opinion or sentiment in progress.
smug-anime-face	Smug Anime Face	Smug Anime Face refers to a variety of reaction images featuring anime characters with a smug smile on their faces that are often used in manga and anime-related discussions.
party-hard	Party Hard	Images on this gallery may trigger epileptic seizures. View it with caution.
paul-blart-mall-cop	Paul Blart: Mall Cop	Paul Blart: Mall Cop is a duology of action-comedy movies directed by Steve Carr and starring Kevin James as the titular character Paul Blart. In spite of their poor reception, the movies became popular online due to their promotional posters, which were popularly edited by manipulating the image and making anagrams of the title and subtitle, in a similar style to Expand Dong.
first-world-problems	First World Problems	"First World Problems" are frustrations and complaints that are only experienced by privileged individuals in wealthy countries. It is typically used as a tongue-in-cheek comedic device to make light of trivial inconveniences.
and-not-a-single-fuck-was-given-that-day	And Not a Single Fuck Was Given That Day	"And Not a Single Fuck Was Given That Day" is a modified version of the colloquial phrase "I don’t give a fuck" which is usually applied to images wherein the subject generally appears relaxed or carefree.
dat-boi	Dat Boi	Dat Boi, a colloquial pronunciation of “that boy,” is a nickname given to a 3D character model of a green frog riding a unicycle, typically accompanied by catchphrases like "here comes dat boi!" and "o shit waddup," that went viral on social media in early 2016.
advice-dog	Advice Dog	Advice Dog is an image macro series featuring a cute puppy's face against a color-wheel background, usually accompanied by unrelated advice and ridiculous instructions.
murica	'Murica	’Murica or ’Murika is a slang term for America which is used to denote extreme patriotism, coupled with aspects of a redneck or southern American stereotype similar those featured in the advice animals Redneck Randal or Almost Politically Correct Redneck. It can also be found on image macros to either support or criticize American stereotypes.
pokeparents-pokedads	Pokeparents / Pokedads	Pokeparents (also knowed as Pokedads) is an Advice Dog-style image macro series with an image of a Pokémon. The images are stereotiped with a type of parent, family member or friend. For example, the Blastoise macros are about an awesome dad, or the Ninetails macros are about a MILF mom.
fuck-the-police	Fuck The Police	“Fuck The Police” (sometimes spelled Fuck Tha Police) is a catchphrase commonly used in times of contempt for authority figures and/or general disregard for public opinion in similar vein to the expression Haters Gonna Hate.
wat	Wat	“Wat” is a variant of the English word “what” that is often used to express confusion or disgust, much like its better known acronym “WTF,” short for “what the fuck.” Although the term “wat” is most frequently used as an interjection without a question mark, it is sometimes used to caption reaction face images or peculiar images that would evoke similar responses.
slaps-roof-of-car	Slaps Roof of Car	Slaps Roof of Car is a popular phrasal template featuring a mock conversation between a car salesman and potential buy in which the salesman emphasizes the phrase "this bad boy can fit so much X in it" by slapping the roof of the car. The phrase is frequently used as the caption to an illustration of a car salesman and the buyer.
ermahgerd	Ermahgerd	Ermahgerd, a rhotacized pronunciation of “oh my god,” is an image macro series featuring a photo of a young woman holding several books from the children’s horror fiction series Goosebumps. The phonetically written captions are meant to sound like a speech impediment caused by the use of an orthodontic retainer, often using the snowclone template “Ermahgerd X.”
get-out-frog-frogout-me-obrigue	Get Out Frog / Frogout / Me Obrigue	Get Out Frog, also known as the “Something Awful Frog” or “Frogout,” is an exploitable image of a stuffed frog’s face that is often featured in animated GIFs and photoshopped images, particularly within the Something Awful forum community. As its name suggests, images of the frog may be used to single out an individual in a group discussion or to show him or her the door.
doom-paul-its-happening	Doom Paul / It's Happening	Doom Paul is an image macro and animated GIF series featuring American physician Ron Paul. Originally used to jokingly depict what could happen if Ron Paul was not elected for President during the 2012 elections, the images eventually grew to be used alongside incoming events to jokingly indicate that their arrival will have apocalyptic results. A common catchphrase used in combination with Doom Paul image macros is “It’s Happening!”
chubby-bubbles-girl	Chubby Bubbles Girl	Chubby Bubbles Girl is a photoshop meme based on a photograph of a girl running through a yard with a bubble maker in her hand. This exploitable series is similar in form to Disaster Girl, Crasher Squirrel and Thundersnow Ice Cream Cone Guy.
trollestia-molestia-tyrant-celestia	Trollestia / Molestia / Tyrant Celestia	“Trollestia” and “Tyrant Celestia” are nicknames for Princess Celestia from My Little Pony Friendship is Magic that are associated with the act of trolling, and have inspired image and video derivatives of the Princess acting mischievously.
nessa	Nessa	Nessa is a gym leader set to appear in the upcoming Pokémon Sword and Shield video games. After her cameo in the Nintendo Direct for E3 2019, she quickly developed a massive fandom, as fans created memes and fan art about the character, similar to their response to Sonia.
cool-story-bro	Cool Story, Bro	Cool Story, Bro is a catchphrase often used in sarcastic response to a lengthy or off-track story that one could really not care less about.
kanye-interrupts-imma-let-you-finish	Kanye Interrupts / Imma Let You Finish	Kanye Interrupts, also known as “Imma let you finish,” refers to an on-air mishap that occurred during Taylor Swift’s acceptance speech for Best Female Video at the 2009 MTV Video Music Awards. During the speech, Kanye West suddenly went up to the stage and took the microphone from Swift to declare that Beyonce had “one of the best music videos of all time.”
i-took-an-arrow-in-the-knee	I Took an Arrow in the Knee	"I Took an Arrow in the Knee" is a memorable quote based on a stock line often repeated by a non-playable character in the open world role-playing game The Elder Scrolls V: Skyrim. Upon the release of the game in November 2011, the quote instantly became a popular subject of image macro parodies on Reddit.
stock-photography	Stock Photography	Stock Photos are photographs created specifically for the purpose of commercial licensing. Because of the need to create photos that will suit a wide variety of situations, photographers and agencies creating stock photos often include images that play off of cultural stereotypes and cliches. Stock Photos are known for their crude illustrations of everyday life and numerous instances where they illustrate very unusual situations.
huahuehuahue	Huahuehuahue	“Huahuehuahue” is an onomatopoeic expression of hearty laughter in Portuguese, equivalent to “hahahaha” in English. Due to its frequent use by Brazilians in massively multiplayer online games such as Ragnarok Online and League of Legends, the phrase is also used by non-Brazilians in a pejorative manner similar to the connotation carried by the Korean expression “KEKEKE” in the multiplayer real-time strategy game Starcraft.
your-argument-is-invalid	Your Argument Is Invalid	"Your Argument is Invalid" is a popular catchphrase often used as a playful counter-response in online discussions.
bear-grylls-better-drink-my-own-piss	Bear Grylls / Better Drink My Own Piss	"Better Drink My Own Piss" is an image macro series featuring a photo of Edward "Bear" Grylls, the host of UK’s wildlife survival series Born Survivor, also known as Man vs. Wild in the US, Canada, Australia and New Zealand.
did-you-know	Did You Know?	“Did You Know?” is a single topic blog featuring various trivia and factoids on a wide range of subject topics, as well as odd news stories and popular misconceptions that are factually inaccurate. This blog has led to creation of several other spin-off blogs on Tumblr, ranging from parody blogs to single topic blogs focusing on niche interests.
law-for-kids-psa	Law For Kids PSA	Law for Kids parodies (a.k.a. “Lawl for Kids”) are a series of exploitable comics based off of an educational website for kids. The original site, Law For Kids, was a web site dedicated to teaching children about the laws in Arizona. Due to its campy “youth-in-trouble” scenarios, highly predictable moral lessons and simple art, Law for Kids comics have become a popular subject of parodies and satires on the web.
condescending-wonka-creepy-wonka	Condescending Wonka / Creepy Wonka	Condescending Wonka is an advice animals image macro series featuring a screen capture of actor Gene Wilder in the 1971 musical Willy Wonka and the Chocolate Factory. As its name suggests, the captions can be characterized as patronizing and sarcastic.
yo-fryman	Yo, Fryman!	Yo, Fryman! is a photoshop meme based on an outline drawing of the character Carl Brutananadilewski from the animated TV series Aqua Teen Hunger Force. Similar to other character-based exploitables, the base image is often custom-edited to resemble other fictional characters.
do-want-do-not-want	Do Want / Do Not Want	"Do Not Want" is a terse expression that's become synonymous with a thumbs down.
creepy-villager	Creepy Villager	The Villager (a.k.a Creepy Animal Crossing Villager) is a nickname given to the male protagonist character of Nintendo’s social simulation video game franchise Animal Crossing. Following the announcement of his inclusion as a new character for the Super Smash Brothers franchise in June 2013, fans of the game quickly began characterizing the Villager as a psychotic and ruthless killer through image macros and video remixes.
hentai-woody-%E5%A4%89%E6%85%8B%E3%82%A6%E3%83%83%E3%83%87%E3%82%A3%E3%83%BC	Hentai Woody / 変態ウッディー	Warning: The following contains photos that can (and will) ruin your childhood memories.
smugleaf	Smugleaf	If Troll Face was reincarcerated as a Pokémon…
harambe-the-gorilla	Harambe the Gorilla	Harambe the Gorilla was a 17-year-old Western lowland silverback gorilla who was shot and killed at the Cincinnati Zoo after a child fell into his enclosure in late May 2016. The incident was wildly criticized online by many who blamed the child's parents for the gorilla's untimely death.
ellen-baker-new-horizon	Ellen Baker (New Horizon)	Ellen Baker (Japanese: エレン・ベーカー) is a fictional tutor character featured in the 2016-2019 edition of New Horizon, a  Japanese textbook that is widely used for English-language education in middle schools. After being mentioned by Japanese students on Twitter in April 2016, she instantly became a subject of moe character art on the Japanese web.
spongegar-primitive-sponge-caveman-spongebob	SpongeGar / Primitive Sponge / Caveman Spongebob	Caveman Spongebob is a reaction image used in the music board of 4chan, /mu/  to show disgust and pedantic behavior towards certain aspects of music. The image has become tied with the greentext “band has 2 drummers”.
oh-crap-omg-rage-face	Oh Crap / OMG Rage Face	The Oh Crap or OMG Face refers to an exploitable image used in rage comics to express an array of feelings including astonishment, revelation, or sheer rage. It is often paired with red or white text, summing up the character’s thoughts. It is also used to represent a Gropaga, or follower of Inglip.
cinemagraphs	Cinemagraphs	Cinemagraphs are partially animated photographs in which a subtle movement action occurs.
bitches-dont-know	Bitches Don't Know	A braggardly young man flaunts his genitals via a t-shirt, only for his image to get edited to no end.
untoons	Untoons	Untoons are three-dimensional illustrations of cartoon and video game characters with photorealistic details while maintaining cartoon-like proportions. The “untooning” process typically involves compositing images of facial features over a 3D rendering of the subject. Untoons can be seen as a digital extension of hyperrealism, a genre of painting and sculpture resembling a high-resolution photograph.
captchart	CAPTCHArt	CAPTCHArt is a word-image association game that involves drawing comics using a combination of two words randomly generated by reCAPTCHA, an automated challenge-response test used by websites to prevent spambots from creating posts or registering as a user.
shadman	>Shadman	>Shadman is an expression used within various online communities to express a distaste for work created by the artist Shadman. The phrase is often paired with images of characters walking out of doors, mainly Winslow T. Oddfellow from the 1999 cartoon series CatDog.
200-mad	200% Mad	200% Mad is a reaction image series featuring angry-looking subjects accompanied by the caption “200% Mad” written in the cut-out character style of the Expand Dong meme.
internet-is-leaking	Internet Is Leaking	Have you seen Internets on the streets lately? Help us fatten up this entry by submitting your own sightings of memes in real life!
fake-ccg-cards	Fake CCG Cards	Spoofs of CCG cards typically found online today are image parodies of the more famous CCG games of Magic: The Gathering, Yu-Gi-Oh!, and Pokemon.
do-it-for-her	Do It For Her	“Do It For Her” is a memorable phrase taken from a 1995 episode of the American animated sitcom The Simpsons, in which character Homer Simpson covers up his demotivational poster at the workplace with photographs of his daughter Maggie in order to create a positive message. On the web, Homer’s family memorabilia has since been parodied many times as a way to commemorate a loved one, either real or fictional.
seems-legit-sounds-legit	Seems Legit / Sounds Legit	“Seems Legit” is an expression mostly used in image macros as a sarcastic retort to a poor attempt at deception or factually questionable statements.
foul-bachelorette-frog	Foul Bachelorette Frog	Foul Bachelorette Frog is the female counterpart of the Foul Bachelor Frog advice animal image macro series. The overlaid text typically frames her as being unhygienic, lazy, and jobless.
gangnam-style	Gangnam Style	Gangnam Style is a 2012 dance pop single written and performed by Korean pop singer PSY. Its music video has gone viral on YouTube with more than 8 million views in two weeks.
cupcakes	Cupcakes	WARNING: This entry contains violent imagery. Viewer discretion is advised.
bitches-love-smiley-faces	Bitches Love Smiley Faces	“Bitches Love X” is an image macro series based on the snowclone template “I got that bitch (X), bitches love (X).” In the template, "X "represents any object, place or entity that may be deemed desirable. In this context, the label “bitches” is used as a mass noun to address any group of audience or viewers, regardless of gender.
new-guy	New Guy	New Guy refers to a character in a comic strip made by artist Mallorie Jessica Udischas, aka sweetbeans99. In the comic, a purple-haired character laughs about a "millionaire gamer-bro douchebag" who got robbed, most likely a reference to PewDiePie getting robbed in early December 2019. Her co-worker, whose nametag reads "New Guy," says, "Hey, how'd you like it if you were robbed?" The purple-haired character then sarcastically remarks that she and the "new guy" could be friends but then says "Hell no." While the comic drew backlash from people who read the comic as the author laughing at PewDiePie's misfortune, others began to sympathize with the "new guy" character, creating fan art emphasizing his wholesomeness.
i-will-survive	I Will Survive	I Will Survive is a webcomic created by DeviantArtist Borba featuring characters from the 2016 animated film Zootopia. First published in March 2017, the comic has become a popular exploitable in early December of that year with many mocking the approach the comic took to the issue of abortion rights. While many accused the comic of taking an “anti-abortion” stance, Borba has denied the comic was written to push a pro-life agenda.
stefan-karl-stefansson-robbie-rotten	Stefán Karl Stefánsson / Robbie Rotten	Robbie Rotten was the primary antagonist in the Nick Jr. children’s television series LazyTown played by the Icelandic film and stage actor Stefán Karl Stefánsson. That character is known for being a lazy man who constantly schemes to undermine the influence of the protagonists Stephanie and Sportacus.
steven-crowders-change-my-mind-campus-sign	Steven Crowder's "Change My Mind" Campus Sign	Steven Crowder’s “Change My Mind” Campus Sign is a photograph of conservative podcaster Steven Crowder seated behind a sign that reads “Male Privilege is a myth / Change My Mind” outside of Texas Christian University. Since its upload via Crowder’s Twitter account in February 2018, the photograph has been turned into an exploitable template for online parodies.
the-main-difference-between-europe-and-usa	The Main Difference Between Europe and USA	The Main Difference Between Europe and the USA is an image macro series that depicts the stereotypical cultural differences between Europeans and Americans. The series later evolved to juxtapose cultural stereotypes from a variety of different countries.
gamer-joker-gamers-rise-up-we-live-in-a-society	Gamer Joker / Gamers Rise Up / We Live in a Society	Gamer Joker, also known as Gamers Rise Up and We Live in a Society, is an image macro series featuring depictions of the DC Comics supervillain Joker accompanied by intentionally edgy or cringeworthy captions. The memes typically praise video game enthusiasts and criticize women named Veronica who friendzone them in favor of dating "jocks". Examples of the meme are frequently submitted to the Gang Weed Facebook page.
the-rock-driving	The Rock Driving	The Rock Driving is a multi-pane exploitable comic series based on several screen captured images from the 2009 family adventure film Race To The Witch Mountain. The comics usually begin with the film’s protagonist Jack asking Sara a question while driving, to which she responds with a shocking revelation that makes Johnson turn his head with a startled facial expression.
roll-safe	Roll Safe	Roll Safe is an image macro serious featuring a screenshot of actor Kayode Ewumi grinning and pointing to his temple while portraying the character Reece Simpson (a.k.a. “Roll Safe”) in the web series Hood Documentary. The image is often captioned with various jokes mocking poor decision making and failures in critical thinking.
good-guy-greg	Good Guy Greg	Good Guy Greg (GGG) is an advice animal character based on a photograph of a square-jawed man smiling at the camera with a marijuana cigarette in his mouth. As the antithesis of Scumbag Steve, the image macros generally depict the character as kind, generous or empathetic to other people.
yao-ming-face-bitch-please	Yao Ming Face / Bitch Please	Yao Ming Face is a rage comic-style contour drawing of the Chinese retired professional basketball player Yao Ming wearing a hearty smile. The image is typically used as a reaction face to convey a dismissive attitude towards someone else’s input in online discussions, then usually following something that one ups their input.
who-would-win	Who Would Win?	Who Would Win? is an image macro series posing the question “who would win” in various hypothetical battles between two opposing subjects.
tear-jerker	Tear Jerker	“Tear Jerker”, or “Tearjerker”, is a slang term used to describe various melodramatic stories and online media that are meant to invoke feelings of sadness, sorrow or despair for the viewer.
son-i-am-disappoint	Son, I Am Disappoint	Son, I am disappoint is a series of exploitable comics illustrating uneasy or disconnected dialogues between a son and a father. It is similar in nature to What’s All This Racket, Son, although the phrase is used to express disappointment in someone’s actions or words, rather than irritation. The phrase “I am disappoint” itself has gained much more popularity than the original comic.
