lord-marquaad-e	Lord Marquaad E	Lord Marquaad, also known as Lord Farquaad / Markiplier E, refers to a deep fried image of the face YouTube Let's Player Markiplier photoshopped onto the head of Lord Farquaad from Shrek with the letter "E" in impact font overlaying the image. Later edits posted the face over an image of Mark Zuckerberg's Congressional Hearings. The character was then edited in several templates referencing the absurdity of modern memes.
the-d	The D	The D is an abbreviated term most commonly referencing to the word “Dick”, a slang term for the male penis. On the internet, the term is often used as an euphemism for requesting intercourse, specifically from a man, in either first or third person narration. This is commonly done in the form of catchphrases such as “I Want The D” or “She Wants The D”.
birds-with-arms	Birds with Arms	Birds With Arms is a photoshop meme in which images of birds are edited to have human arms editing on to their sides where their wings would have been.
yaoi-hands	Yaoi Hands	Yaoi Hands, also known as “Yaoi hand syndrome”, is a term for aggrandized hands that can be found in Yaoi, a homoerotic fictional media intended for female consumption. The trope bears similarities to several other anime devices, including exaggerated breasts and gag boobs as seen in Mega Milk / Titty Monster.
elf-on-the-shelf	Elf on the Shelf	Elf on the Shelf is a Christmas-themed elf doll and the protagonist character of the 2005 children’s book with the same name. Since its emergence to mainstream popularity, the decorative figurine has inspired parody photographs in which the Elf is staged in a wide range of erotic, creepy or otherwise disturbing settings, in similar vein to Hentai Woody and other figurine-based photo fads.
zelda-cd-i	Zelda CD-i	Zelda CD-i remixes are a series of mash-up and parody videos based on cutscenes from The Legend of Zelda CD-i games. Due to its lackluster quality in animation and shoddy dialogues, the remix series became immensely popular within YouTube Poop community and spawned hundreds of derivatives featuring characters from Zelda CD-i games. The videos are quite notable for their extreme deviations from The Legend of Zelda canon, including the depiction of the Triforce as a blue pyramid and the premise of having Zelda save Link.
original-vs-un-tumblrized	Original vs. Un-Tumblrized	Original vs. Un-tumblrized refers to a series of exploitable, photoshopped comparison charts in which one side shows a character, and the other, “un-tumblrized” side shows a sexier artistic interpretation of that character. The word “un-tumblrized” here implies that a character was originally designed to appeal to the Tumblr community, which has a reputation for demanding media representation for many races, gender expressions, and body types. After an image began circulating of a comparison chart between the female character Tank Penny from Fortnite and an “un-tumblrized” version which imagines her skinnier, whiter, and in skimpier clothing, people began to parody the format with various humorous comparisons.
i-herd-u-liek-mudkips	I Herd U Liek Mudkips	The thrilling story of a boy, his love for the Pokémon Mudkip, and how far he would go to show his love.
planking	Planking	Planking, often referred to as the "planking craze", refers to the act of lying face down with arms to the sides in unusual public spaces and photographing it to share online.
this-post-was-made-by-x-gang	This Post Was Made By X Gang	This Post Was Made By X Gang refers to a series of satirical image macros which are tagged to make them appear as though they're sponsored by a collective of memers. Images in this meme tend to feature an image macro describing one object in a negative light in impact font, accompanied by a watermark which is an image macro for a "gang" centered around an object opposed to the image's subject.
om-nom-nom-nom	Om Nom Nom Nom	"Om Nom Nom Nom" is internet slang used to indicate eating.
antoine-dodson-bed-intruder	Antoine Dodson / Bed Intruder	Antoine Dodson is a college student from Huntsville, Alabama who became an overnight celebrity after giving a passionate TV interview in defense of his sister who was awakened by a late-night bedroom intruder.
facebomb	Facebomb	Face Bombing is a photoshop technique that involves sampling the face of an individual in a group photograph, which is then superimposed over the faces of everyone else shown in the same image. In contrast to face swapping, which strictly entails switching the faces of two individuals in a photograph, face bombing can be distinguished by its multiplication of one particular individual’s face.
shit-im-late-for-school	Shit, I'm Late For School	“Shit, I’m Late for School” is a photo fad in which participants typically make an exaggerated running motion while carrying various objects in their mouth, accompanied by the phrasal template “Shit, I’m late for X school!” The pose is inspired by an anime trope in which students are shown rushing to school while carrying a piece of toast in their mouth.
roses-are-red-violets-are-blue	Roses Are Red, Violets Are Blue	Roses are Red… refer to a variety of short poems featuring rhyme verses that begin with the lines “Roses are red, violets are blue.” While the original poem was used to convey messages of love, many of its derivative versions nullify its sentimental value through subversion, parody and anti-humor.
do-a-barrel-roll	Do A Barrel Roll	"Do A Barrel Roll" is a catchphrase used to call on someone to perform a 360 degree horizontal spin. The phrase is sometimes used to caption image macros where the subject appears to be in mid-rotation, or in animated GIFs where the subject is performing a full rotation.
dont-look-at-her	Don't Look at Her	"Don't Look At Her" refers to images nude or scantily-clad women edited to have another, usually unrelated character censoring the image and advising the viewer to instead pay attention to them and heed their life advice, sometimes with the phrase "tits are temporary."
actual-advice-mallard	Actual Advice Mallard	Actual Advice Mallard is an advice animal image macro series featuring a photograph of a male wild duck accompanied by captions containing life hacks and other useful information.
daily-struggle	Daily Struggle	“Daily Struggle” is an exploitable comic featuring a character attempting to push one of two buttons labeled with contradicting statements.
paula-deen-riding-things	Paula Deen Riding Things	Paula Deen Riding Things is a photoshop meme spawned from a photograph of celebrity chef Paula Deen riding on another celebrity chef during the South Beach Wine & Food Festival in February 2011.
the-last-supper-parodies	The Last Supper Parodies	The Last Supper Parodies are photoshopped or redrawn images that play off of Leonardo da Vinci’s painting depicting the last supper of Jesus and his twelve disciples.
rikkas-finger-spin	Rikka's Finger Spin	Rikka’s Finger Spin refers to a series of hand-drawn animated GIFs/videos which are tributes to an adorable finger spin by Rikka Takanashi, a main character in a Japanese light novel/anime Love, Chunibyo & Other Delusions. It was a poular subject for fan creations on the Japanese video sharing service Nico Nico Douga (NND) and illustrators community pixiv in 2012-2013.
internet-fight	Internet Fight	Internet Fight is a term used to ridicule the hyper-aggressive and often futile nature of verbal feuds and flame wars that take place online.
i-must-go	I Must Go	“I Must Go, My People Need Me”, also known as “I Must Go, My Planet Needs Me”, is a catchphrase often used in image macros that typically features subjects posed in mid-air. This phrase is used as a comedic device to dramatize images, and make it appear as if they are returning to flying away to assist those in need.
moetron	Moetron	Moetron is a community-made character who was originally just a forced summer meme on 4chan’s /a/. 
She is a character that focuses on things that are “moe.” However, with the same irony as Pedobear and other board-related characters, she has been the subject of discussion to the point of her becoming a legitimate character. Though a few may joke that she is an abomination, she is considered to be /a/’s daughter.
i-have-no-idea-what-im-doing	I Have No Idea What I'm Doing	“I Have No Idea What I’m Doing” is a catchphrase often used in image macro captions featuring photos of animals, typically canines, posed as if they are performing tasks associated with humans.
ebola-chan	Ebola-chan	Ebola-chan is a female anime character designed as an anthropomorphic representation of the Ebola virus. The character was created on 4chan in response to growing concerns regarding the West African Ebola outbreak in the summer of 2014.
lying-down-game	Lying Down Game	Lying Down Game is a participatory photo meme that involves having one's photograph taken whilst lying rigidly face down in public space and then sharing the image via internet.
tag-yourself-tag-your-friends	Tag Yourself / Tag Your Friends	Tag Yourself and Tag Your Friends refer to fandom surveys in which participants are presented with a lineup of celebrities or fictional characters and prompted to identify which are the most relatable to themselves or their peers. Recognizable by the poorly drawn avatars of the characters and ill-phrased descriptions of their traits in Comic Sans, the illustrative surveys went viral on the popular microblogging platform Tumblr in late January 2016.
caramelldansen	Caramelldansen	Caramelldansen (eng. The Caramel Dance) is a series of animated dance videos that use the dance track with the same title. Its original track was released in Supergott which is the 2nd album of the Swedish pop group Caramell in November, 2001.
clever-girl	Clever Girl	“Clever Girl” is a catchphrase that can be used to express respect or admiration for something has demonstrated substantial intelligence. It is often associated with the extinct Velociraptor dinosaur genus. (See also: Philosoraptor, Raptor Jesus)
america-fuck-yeah	America: Fuck Yeah!	“America: Fuck Yeah!” is a multi-purpose expression that can be used as an authentic display of strong approval or an ironic response to extreme or unwarranted patriotism toward the United States of America. The phrase rose to fame after being quoted in the 2004 action comedy film Team America: World Police.
shy-guy	Shy Guy	Shy Guys are antagonists in the Super Mario franchise known for wearing hooded robes and white masks with large eye holes.
autistic-screeching	Autistic Screeching	Autistic Screeching is an exploitable comic series featuring an illustration of two people shaking hands next to a person crouched in anger with the caption “autistic screeching” placed above their head. The screech is associated with the onomatopoeic expression REEEEE and is often used to mock angry reactions to various political ideologies and alliances.
are-you-fucking-kidding-me	Are You Fucking Kidding Me?	“Are you Fucking Kidding Me?” is a rage comic character wearing a scornful facial expression that is typically used in reaction to someone else’s extreme stupidity, similar to the usage of Look of Disapproval (ಠ_ಠ) or X is not amused.
too-much-water	Too Much Water	“Too Much Water” is a quote from the IGN review of Pokemon Omega Ruby and Sapphire cited as one of the drawbacks of the gameplay experience.
please-disconnect-the-bluetooth-speaker	Please Disconnect The Bluetooth Speaker	“Please Disconnect the Bluetooth Speaker.” (also known as “Bluetooth Speaker” or “We need to talk”) is an exploitable template used to show a mother’s disgust or concern in whatever audio the image is showcasing as being listened to while connected to a bluetooth speaker set downstairs. The text notification band at the top of the image is placed over a picture of someone listening to or watching something that could be considered strange or inappropriate.
the-nuzlocke-challenge	The Nuzlocke Challenge	The Nuzlocke Challenge is a type of video game challenge involving the Pokemon series. In it, players must release a Pokemon when it faints, thus declaring it "dead’, and must catch the first Pokemon they encounter in each area.
ayy-lmao	Ayy LMAO	“Ayy LMAO” is an expression and Tumblr hashtag which is almost always associated with pictures of aliens.
grammar-nazi	Grammar Nazi	Grammar Nazi or Grammar Police refers to someone who habitually corrects grammar and / or spelling mistakes made by others in conversation, both on and offline. In most cases, the term carries a negative connotation of either being a buzzkiller who ruins a good joke by getting too technical or a n00b who is gullible enough to be irritated by a Grammar Trap, an intentional use of incorrect grammar for the purpose of trolling.
my-eyes-are-up-here	My Eyes Are Up Here	“My Eyes Are Up Here” is an expression typically used by women to remind men that they should maintain eye contact with the female speaker, instead of staring at her breasts. Online, the phrase is commonly used in feminist commentaries, images of scantily clothed female superhero characters, such as DC Comic’s Power Girl, or alternatively, in the context of a male-identifying person who wants to detract attention from his body.
bread-helmet-man	Bread Helmet Man	Have you ever been so angry at your president that you went to a street protest with bread wrapped around your head?
As anti-government protests continue to intensify across the Arab world, a new face of raging defiance emerges from the streets of Yemen.
wikipedia-donation-banner-captions	Wikipedia Donation Banner Captions	“Wikipedia Donation Banner Captions” refer to screenshot images based on Wikipedia’s 2011 end-of-year fundraising campaign, featuring various combinations of banner ad images and Wikipedia article titles for comedic effect. The screenshots typically juxtapose pictures of Wikipedia staff members or supporters with oddly fitting article titles that bring sexual or inappropriate implications to the reader’s mind.
za-warudo-wryyyyy	Za Warudo / WRYYYYY	“Za Warudo” is the japanese pronunciation of the english word “The World”, the name of Dio Brando’s Stand on the third part of the popular manga and anime series JoJo’s Bizarre Adventure. The main ability from this Stand is time stopping, being the most memorable moves used with it throwing a series of knives while the time is stopped, and slaming a steamroller while pummeling it until explodes, letting out his battlecry “WRYYYY”. Both terms and moves became source of parodies, mostly associated with inverse colors pictures, as a reference to the Stand time stopping abilities.
le	Le	Le, pronounced luh or lay in English, is the masculine singular definite article of the French-language. Due to the widespread perception of le as being stereotypical of the language, it is often used by English speakers to Francize expressions or to mock sophistication in general. In rage comics, le serves as a preface to a word or sentence signifying an action, or in substitute of the.
im-sorry-i-cant-hear-you-over-the-sound-of-how-awesome-i-am	I'm sorry, I can't hear you over the sound of how awesome I am	“Sorry, I can’t hear you over the sound of how awesome I am” is a catchphrase often seen in demotivational image macros when describing a photo of someone or something perceived as awesome, to highlight an awkward moment, or to point out someone’s inflated ego. The phrase is sometimes shortened as “I can’t hear you over how awesome I am.”
edgy	Edgy	“Edgy” is an English slang term used to describe things, behaviors or trends which are provocative or avant-garde, and is often used to describe things that are dark and gothic in nature. It is commonly used as an insult on 4chan and Tumblr for someone attempting to be badass by acting emo or overly contrarian.
i-regret-nothing	I Regret Nothing	“I Regret Nothing” is an expression used unapologetically to convey remorselessness for one’s own actions and its consequences. Usually accompanied by GIF images of characters spinning around, the phrase conveys complete disregard for others similar to the usage of Look At All The Fuck I Give and Fuck the Police.
unpopular-opinion-puffin	Unpopular Opinion Puffin	Unpopular Opinion Puffin is an advice animal image macro series featuring a photograph of a baby puffin and various captions conveying opinions that are thought to be unpopular, in similar vein to other non-conformist  advice animal characters like Confession Bear and Angry Walter.
birthday-scenario-game	Birthday Scenario Game	Birthday Scenario Game is a forum gaming and social media activity that involves matching up the month and date of one’s birthday in a calendar list of pre-assigned situations or scenarios. Similar to other birthday-related word games and survey memes, the Birthday Scenario Game has a particularly strong presence on Tumblr and Facebook.
emoji	Emoji	Emoji are graphical images depicting a wide range of facial expressions, symbols and objects which can be used to convey certain emotions or phrases in SMS and instant messaging, similar to their precursor, emoticons.
clippy	Clippy	Clippit, better known as Clippy, is the default animated character in the English Windows version of Microsoft Office Assistant, an interactive user’s guide that came pre-installed with Microsoft Office bundles from 1997-2003. Due to its impractical and intrusive nature, Clippy quickly became a subject of mockery among Office users, inspiring a series of satirical images and parodies addressing its overall incompetence.
its-a-trap	It's A Trap!	“It’s A Trap!” is a catchphrase that is often used as a reaction image to photos of transsexuals and crossdressers (often referred to as “traps”), or people who appear sexually ambiguous. It usually means that the person in question has male reproductive organs, regardless of their appearance. Though less frequently, the phrase can be also used as a warning of any potential danger. In addition, the quote as it appears in the film has been widely regarded by the fans of Star Wars as one of the most famous and beloved lines from the original trilogy.
captain-america-civil-war-4-pane-captain-america-vs-iron-man	Captain America: Civil War 4 Pane / Captain America vs Iron Man	Captain America: Civil War 4-Pane (also known as Captain America vs Iron Man) is a series of vertical multi-pane image macros based on an exploitable photo set from the 2012 Marvel superhero film The Avengers illustrating a deadlocked conversation between two people at odds, usuall over fandom rivalries.
asdfmovie	asdfmovie	asdfmovie (pronounced “ass-duff”) is an animated flash cartoon series directed and posted by YouTuber TomSka. The videos typically consist of several short skits featuring various stick figure characters and occasional dialogues. Currently, the series consists of 5 episodes with a number of spin-offs and remixes.
differenze-linguistiche	Differenze Linguistiche	Differenze Linguistiche (English: Linguistic Differences) is a series of vertical rage comics illustrating various stereotypes or misperceptions associated with Western languages and their phonetic systems. The comics are usually centered around a single word or a phrase that is phonetically translated into multiple languages.
manbabies	Manbabies	Manbabies are simple image macros/photoshoops -- one swaps the head of the man and the baby, like so:
i-told-you-about-stairs	I Told You About Stairs	“I Told You About Stairs” is a catchphrase from the webcomic series “Sweet Bro and Hella Jeff” written and drawn by MS Paint Adventures creator Andrew Hussie. The comic has become an in-joke within the Homestuck fandom and has been the subject of numerous parody videos and fan arts.
he-does-it-for-free	He Does It for Free	This expression is used to mock 4chan moderators, also known as "janitors," for being too heavy-handed or taking their jobs too seriously.
involuntary-celibacy-incel	Involuntary Celibacy / Incel	*"Involuntary Abstinence" *is a concept of Internet humor that is typically iterated in image macros poking fun at male-oriented hobbies that may be deemed unattractive by the other sex, such as LARPing, cosplaying and video game collecting among others.
slam-remixes-vs-quad-city-djs	Slam Remixes (Vs Quad City DJs)	Slam Remix (alternely known as X Vs. Quad City DJ’s) is a series of remix songs based on the theme song from the 1996 family film Space Jam, originally composed by the Quad City DJ’s. Slam remixes are commonly accompanied by a headshot of former professional basketball player Charles Barkley superimposed over the head of a certain character related to the song.
actually-its-about-ethics	Actually It's About Ethics	“Actually it’s about ethics in gaming journalism” is a phrase often photoshoped onto screenshots taken from horror movies or video-games as a humorous response to the Gamergate movement, mocking the over-use of the phrase by supporters of the movement. Proponents of the movement frequently used the phrase in related discussion.
if-you-know-what-i-mean	If You Know What I Mean	“If You Know What I Mean” is a rage comic character based on a still frame of actor Rowan Atkinson portraying the fictional character Mr. Bean. It is used to point out a double entendre in a post or image macro, commonly in the form of sexual innuendo. Although originally created as a rage face, the character is also used in vertical comics in a similar manner to the You Don’t Say? and We’ve Got a Badass Over Here reaction images.
nailed-it	Nailed It	Nailed It is a idiomatic expression often used online in a sarcastic manner, responding to photos of attempted and failed projects or recipe execution.
kill-me	Kill Me	Kill Me is an image macro series in which people, animals or objects are depicted as if they’re suffering from pain, such as “implied” physical deformity, or otherwise uncomfortable conditions. The images are often accompanied by the caption “Kill me”, reflecting the subject’s desire to be put out of misery.
extreme-advertising	Extreme Advertising	In a world where Cheetos, Doritos, Moutain Dew, and even Looney Tunes have been marketed based on how “extreme” they can be portrayed, spoofs of extreme advertising have arisen in various places and times; both online and off. But within online communities, different memes surrounding amped-up pitches for mundane objects have been created; and others have been inspired to borrow themes and forms from one another.
based-god	Based God	Based God is a catchphrase often used in image macros referring to rap artist Lil B. The overlaid text typically mentions Based God “fucking bitches”, or say “thank you Based God” with an image of someone crying.
buenos-dias-mandy	Buenos Dias, Mandy	Buenos Dias Mandy refers to a line of dialogue in a pornographic comic book adaptation of the children's animated TV series The Grim Adventures of Billy and Mandy. Images and lines from the comic have inspired image macros, photoshops and YouTube videos.
trashcat-is-not-amused	Trashcat Is Not Amused	"X is Not Amused" is an image macro series based on pictures of animals and pop icons looking profoundly unimpressed or even displeased.
guys-literally-only-want-one-thing-and-its-fucking-disgusting	Guys Literally Only Want One Thing And It's Fucking Disgusting	Guys Literally Only Want One Thing refers to a series of tweets which pair various humorous images with a tweet that reads “Guys literally only want one thing and it’s fucking disgusting.”
eyebombing	Eyebombing	Eyebombing is a single topic blog that collects photos of googly eyes placed on inanimate objects in public spaces in order to make them appear as if they have a face.
draw-the-squad	Draw The Squad	Draw the Squad is a fanart trend that involves drawing images with multiple characters in flamboyant, outrageous poses or precarious situations. The trend is usually started with a photograph of people posed uniquely, with the suggestion to artists to replicate with their own choice of characters, either from their OCs or their preferred fandoms. Occasionally, when only two characters are the main focus in the image being replicated, the caption instead reads “Draw your OTP.” The meme has been seen used with screen caps, real-life images similar to Nightmares Fear Factory photos, and also original blank templates for the sole purpose of drawing.
your-tears-are-delicious	Your Tears are Delicious	Your Tears Are Delicious is a phrase often used as a retort to someone complaining about an unpopular opinion or whining about trivial inconveniences.
wake-me-up-inside-cant-wake-up	Wake Me Up Inside (Can't Wake Up)	“Wake Me Up Inside” and “Can’t Wake Up” are lyrics from the 2003 alternative rock song “Bring Me To Life” by Evanescence, which are associated with images of a calm-looking subject juxtaposed next to a picture of the same subject appearing distressed.
half-life-3-confirmed	Half-Life 3 Confirmed	Half-Life 3 Confirmed is a catchphrase associated with the rumored announcement of the fifth installment in the popular Half-Life franchise developed by Valve. Since the release of Half-Life 2: Episode 2 in October 2007, fans have long anticipated the next installment in the franchise, which over time lead to numerous intentionally fake theories that have little to nothing to do with the games, alongside various stories which claim the release of the game to be coincident with The Rapture
springtrap	Springtrap	Springtrap is a violent animatronic resembling a large anthropomorphic rabbit which is the main antagonist of the jump scare horror game Five Nights at Freddy’s 3.
